{
  "$schema": "../../schemas/theme-plugin.schema.json",
  "id": "weather_glass",
  "name": "Weather Glass",
  "version": "0.1.0",
  "apiVersion": "0.1",
  "kind": "theme",
  "author": "QuakeKit",
  "description": "Cool translucent palette intended for weather and ambient dashboards.",
  "palette": {
    "mode": "dark",
    "colors": {
      "background": {
        "value": "#071016",
        "role": "Night sky background",
        "configurable": false
      },
      "surface": {
        "value": "#112638D9",
        "role": "Translucent glass surface",
        "configurable": true
      },
      "surfaceRaised": {
        "value": "#1A3C54E6",
        "role": "Raised glass surface",
        "configurable": true
      },
      "border": {
        "value": "#5CC8FF66",
        "role": "Glass rim",
        "configurable": true
      },
      "textPrimary": {
        "value": "#F7FCFF",
        "role": "Primary text",
        "configurable": false
      },
      "textSecondary": {
        "value": "#B7D8E8",
        "role": "Secondary text",
        "configurable": false
      },
      "accent": {
        "value": "#5CE1FF",
        "role": "Weather highlight",
        "configurable": true
      },
      "success": {
        "value": "#8DFFB1",
        "role": "Favorable state",
        "configurable": true
      },
      "warning": {
        "value": "#FFE082",
        "role": "Watch state",
        "configurable": true
      },
      "danger": {
        "value": "#FF708D",
        "role": "Alert state",
        "configurable": true
      }
    },
    "semanticColors": {
      "background": "background",
      "surface": "surface",
      "surfaceRaised": "surfaceRaised",
      "border": "border",
      "textPrimary": "textPrimary",
      "textSecondary": "textSecondary",
      "accent": "accent",
      "success": "success",
      "warning": "warning",
      "danger": "danger"
    }
  },
  "typography": {
    "displayFont": "SF Pro Rounded",
    "bodyFont": "SF Pro",
    "monoFont": "SF Mono",
    "scale": {
      "caption": 13,
      "body": 16,
      "title": 26,
      "value": 42
    }
  },
  "metrics": {
    "cornerRadius": 8,
    "borderWidth": 1,
    "spacing": 12,
    "density": "comfortable"
  },
  "components": {
    "tile": {
      "background": "surface",
      "foreground": "textPrimary",
      "border": "border",
      "accent": "accent",
      "selectedBackground": "surfaceRaised",
      "selectedBorder": "accent"
    },
    "tab": {
      "background": "surface",
      "foreground": "textPrimary",
      "border": "border",
      "selectedBackground": "surfaceRaised",
      "selectedBorder": "accent"
    },
    "statusRow": {
      "background": "surface",
      "foreground": "textPrimary",
      "border": "border",
      "accent": "accent"
    },
    "gauge": {
      "background": "surface",
      "foreground": "textPrimary",
      "accent": "accent"
    },
    "chart": {
      "background": "surface",
      "foreground": "textPrimary",
      "accent": "accent"
    }
  },
  "hardware": {
    "knobRing": {
      "enabled": true,
      "idle": {
        "color": "border",
        "intensity": 0.18,
        "animation": "solid"
      },
      "focus": {
        "color": "accent",
        "intensity": 0.65,
        "animation": "pulse"
      },
      "success": {
        "color": "success",
        "intensity": 0.75,
        "animation": "solid"
      },
      "warning": {
        "color": "warning",
        "intensity": 0.85,
        "animation": "pulse"
      },
      "danger": {
        "color": "danger",
        "intensity": 1,
        "animation": "flash"
      },
      "progress": {
        "color": "accent",
        "intensity": 0.7,
        "animation": "progress"
      }
    }
  },
  "layout": {
    "defaultPageStyle": "thirds",
    "widgetGrid": {
      "columns": 3,
      "rows": 2
    },
    "appletGrid": {
      "columns": 3,
      "rows": 1
    },
    "splitRatio": 0.34
  },
  "assets": [
    {
      "id": "weatherBackdrop",
      "kind": "image",
      "path": "assets/backdrop.svg",
      "role": "background",
      "fit": "cover",
      "opacity": 0.42,
      "scale": 1
    }
  ],
  "options": [
    {
      "id": "accentColor",
      "title": "Accent color",
      "type": "color",
      "target": "palette.colors.accent.value",
      "defaultValue": "#5CE1FF"
    },
    {
      "id": "surfaceColor",
      "title": "Glass surface",
      "type": "color",
      "target": "palette.colors.surface.value",
      "defaultValue": "#112638D9"
    },
    {
      "id": "borderColor",
      "title": "Glass border",
      "type": "color",
      "target": "palette.colors.border.value",
      "defaultValue": "#5CC8FF66"
    },
    {
      "id": "cornerRadius",
      "title": "Corner radius",
      "type": "number",
      "target": "metrics.cornerRadius",
      "defaultValue": 8,
      "minimum": 2,
      "maximum": 16
    },
    {
      "id": "spacing",
      "title": "Spacing",
      "type": "number",
      "target": "metrics.spacing",
      "defaultValue": 12,
      "minimum": 8,
      "maximum": 18
    },
    {
      "id": "density",
      "title": "Density",
      "type": "choice",
      "target": "metrics.density",
      "defaultValue": "comfortable",
      "choices": [
        "compact",
        "standard",
        "comfortable"
      ]
    }
  ]
}
